industry,slug,title,keyword,read_time,article_type
getting-started,do-i-need-a-website,Do I Really Need a Website for My Business,do i need a website,8,guide
getting-started,when-to-get-website,When Should You Get a Website for Your Business,when to get website,7,guide
getting-started,website-planning-guide,Website Planning Guide for Small Business,website planning guide,9,guide
getting-started,what-to-put-on-website,What to Put on Your Business Website,what to put on website,8,guide
getting-started,website-content-checklist,Website Content Checklist for Small Business,website content checklist,7,checklist
getting-started,how-to-write-website-content,How to Write Content for Your Business Website,how to write website content,9,guide
getting-started,website-pages-you-need,Website Pages Every Small Business Needs,website pages you need,7,checklist
getting-started,choosing-domain-name,How to Choose a Domain Name for Your Business,choosing domain name,7,guide
getting-started,domain-name-tips,Domain Name Tips for Small Business,domain name tips,6,guide
getting-started,website-hosting-basics,Website Hosting Basics for Beginners,website hosting basics,7,guide
getting-started,how-websites-work,How Websites Work: A Simple Explanation,how websites work,6,guide
getting-started,website-terminology,Website Terminology Every Business Owner Should Know,website terminology,8,guide
getting-started,website-timeline,How Long Does It Take to Build a Website,website timeline,6,guide
getting-started,website-launch-checklist,Website Launch Checklist for Small Business,website launch checklist,8,checklist
getting-started,after-website-launch,What to Do After Your Website Launches,after website launch,7,guide
getting-started,website-maintenance-basics,Website Maintenance Basics for Small Business,website maintenance basics,6,guide
getting-started,updating-website-content,How Often Should You Update Your Website,updating website content,6,guide
getting-started,website-security-basics,Website Security Basics for Small Business,website security basics,7,guide
getting-started,ssl-certificate-explained,SSL Certificates Explained for Small Business,ssl certificate explained,6,guide
getting-started,website-backup-importance,Why Website Backups Matter,website backup importance,5,guide
getting-started,hiring-web-designer,How to Hire a Web Designer,hiring web designer,8,guide
getting-started,questions-for-web-designer,Questions to Ask Before Hiring a Web Designer,questions for web designer,7,checklist
getting-started,web-design-red-flags,Web Design Red Flags to Watch For,web design red flags,7,mistakes
getting-started,website-contract-tips,Website Contract Tips for Small Business,website contract tips,7,guide
getting-started,website-ownership,Who Owns Your Website: What You Need to Know,website ownership,7,guide
getting-started,website-for-new-business,Getting a Website for Your New Business,website for new business,8,guide
getting-started,website-for-side-hustle,Do You Need a Website for a Side Hustle,website for side hustle,6,guide
getting-started,website-for-freelancers,Website Essentials for Freelancers,website for freelancers,7,guide
getting-started,website-for-consultants,Website Guide for Consultants,website for consultants,8,guide
getting-started,first-website-mistakes,First Website Mistakes to Avoid,first website mistakes,7,mistakes
